title,upvotes
WOP-P,0
Any recommendations for IO Psychology graduate programs?,0
Challenge finding a career according to personality,0
Anyone knows any research on relationship between PERCEIVED ORGANIZATION POLITICS and TURNOVER INTENTION. ???,0
Talent review,0
Join my psychology and typology based discord server! 18+,0
Ideas ,0
Please help me answer this question,0
Is police or a start up businnes more transactional,0
Bank CEO leadership,0
Looking on SIOP website for call for proposals for 2024 conference,3
Any good bachelors programs for I/O psychology in California?,3
"Bi-Weekly /r/IOpsychology Discussion - What have you been reading, and what do you think of it?",3
Help,3
How will we test AIs for IQ?,4
Best place to intern for I/O Psychology during school? Best way to get an internship?,4
"How much do you advice is a fair cost for a project involving: designing a culture survey, running it on quarterly basis over a year (two full and two pulse checks), data analysis, report writing and presentation of results (PPT and reports x 4; one set per survey). Its a small organisation.",3
PI Behavioral Test,3
What Were Your GRE Scores? [Admission for Masters Programs],3
Career Change - Tech Exec to Psychology - Ideas &amp; Help?,3
NYT DEIB Article,3
Psychology Applied to Work,3
Sustained interest and actions post Behavioural assessments,3
skills-ml,3
Management of Dependent Personality Disorder in the Workplace,4
RMPA Presentations?,3
Journal recommendations,3
Econ and psychology double major?,3
"Trying not to be discouraged, please help! Re: PhD in I/O Psych",2
Looking for Consulting Firms that provide culture services amidst M&amp;A,3
Suggested reading before MSc in IO Psych (UK),3
Poster Printing at SIOP Conference site?,3
How did you find jobs in fields such as Change Management and Organisational Development? What does a typical day look like for you? Any advice for someone in the UK looking to pursue these roles?,2
Exam plans for job analysis,3
Invitation for Professionals,3
"What is the difference between work, organisational and Human Resources psychology ",2
I/O domains,2
I/O psychology or Clinical psychology?,2
SHRM,2
Advice for I/O Psychology,2
Behavior Change/Change Management Resources,2
How likely do you guys think it is that AI will take your job?,2
Research Question,2
Only in America?,2
Undergraduate Path - Business Double Major?,2
Is studying cognitive psychology/knowledge acquisition in undergrad going to help with I/O Psych grad school &amp; field work?,2
Experimental research approach,2
SIOP 2024?,1
"According to this study by Qualtrics, 46% of market researchers feel 'very confident' using AI in their work.",2
Need Advice and Suggestions,2
School interview,2
Time to finish degree,2
"What is the viability of projection testings? How much they are accurate in accessing an individual's personality, what are its limitations?",2
Meeting facilitation question,2
Companies that would benefit from a training program?,2
Help me please,3
audiobook recommendations,2
Searching UK Internships,2
NYU vs Columbia vs Baruch Masters,2
grad cap ideas?,2
Advice regarding Masters in OD vs HRM,2
"Bi-Weekly /r/IOpsychology Discussion - What have you been reading, and what do you think of it?",2
Examples of personality tests used in selection?,2
Informed Consent for Job Applicants?,2
How do you feel about McKinseys Imbellus game?,2
Hood Color? ,2
FT internal job with PT consulting side gig. A conflict of interest?,2
Subsidized Certs,2
interview invite,2
"Hello all, I am looking into some distance learning I.O phycology in Germany in private universities, I want to jear some general opinions for thoose, has anyone studied or has connections that studied there and can provide any info ?",1
Manufacturing?,1
"non-EU, IO Careers",1
"Any Open Access ""top journals"" in our field?",1
What is an acceptable salary for this position?,1
Work Sample/Portfolio,1
Masters in Psychology (Clinical or industrial),1
Which program,0
Question on job analysis survey items,1
Regular content you review as a practitioner?,1
Research on Family-Supportive Supervisor Behaviors,1
Assessment Help - Scoring for Speed and Accuracy,1
POP and TOI scales,1
Why do psychometricians use interaction model instead of Chi square to test fit of data?,1
Scope of IO psych,1
Shadowmatch,1
Questions About Prospective Online Grad Program,1
Is this the right flow for a workshop?,1
Salary and growing areas of I/O,1
"Does anyone have any ideas or suggestions for a topic question to research for a psych thesis, thats related to IO psychology?",1
completed masters in I/O looking for courses,1
Interview questions or group interviews,1
job prospects in canada and germany,1
SIOP Conference - Activation Code?,1
Does rem experience transfer well/ if at all - to OD roles?,1
Is mission alignment considered job relevant?,1
Criteria Corp Aptitude Test,1
Jobs,0
Persuade me into pursuing a masters in IO Psych,0
Best place to find Case Studys?,0
"Hey guys! Looking for grad schools for Industrial and Organizational Psychology! Whatre the best grad schools in your opinion with excellent programs. Any recommendations within Europe, Canada, and or the States?",0
Compassion as a Daily Practice -- leadership skills,0
I/0 QUESTION???,0
"Sociopaths, Losers and Clueless: Revisiting the Organizational Theory of The Office",0
"Hello. I'm from India,I am interested in studying Organisational Psych in the UK so applied for a few courses, got an Offer Letter from Birkbeck for their MSc in Organisational Psychology program, is it a good course,good university? can someone from the UK please answer.",0
"Hey! Does anyone have a good dissertation topic idea related to leadership and trust? Im hoping to collect the majority, if not all of my data online, so bonus if the topic allowed for that. Thanks!",0
Leader Influence Course,0
new haven vs hofstra,0
Cornell career fairs this spring?,0
Research related question ,0
Research Topic Suggestions,0
Program decision help,5
Complementary studies for the degree?,4
Help im confused!,5
HR options &amp; PhD ?s. ,6
Psychological safety measure ,4
"Besides funding, how can public policy support creativity in society?",4
How to get my school to add an I/O psych class?,4
Looking for an Interviewee,3
"Bi-Weekly /r/IOpsychology Discussion - What have you been reading, and what do you think of it?",5
Social structures in remote vs. in-person work,5
Anyone with an M.S. in I-O Psych working in Operations at a Company? Career Question,4
What kind of internship expereince will help with grad school applications?,3
Learning Masterclass: Why Learning Isn't a Spectator Sport with Charles Jennings,4
[Philippines] Engagement Consultant,5
best undergrad double major OR minor?,4
Stuck in limbo,4
Would you recommend a non-us to do masters in the USA?,4
Bachelor's Degree for an I/O Psych Career,4
CORE RECON Assessment,3
advice,4
Minor in Business Administration or Human Resources?,3
"I'm 15 years old and thinking of pursuing the same job as my aunt, I still don't have proper knowledge of Industrial and Organizational Psychology. It will be great if you can give me your opinion in this kind of topic in simple terms (Thank YOU!!!)",4
"I/O accelerated masters, I/d/k? Indecisive &amp; worried..me too.",4
Associate's in Human Resource Management then Bachelor's in Applied Psychology?,4
what skills are required to be better than others?,3
career path,4
Consultant,4
South African Junior Graduate options,5
Outside opportunities for a research career?,3
Recommendations for undergraduate-friendly Personnel Psychology textbooks?,5
Personal Thoughts on IOPsychology,5
I/O psychology or pursue school psychology??(please help),3
Hogan 360 Certification Vendors,5
"Bi-Weekly /r/IOpsychology Discussion - What have you been reading, and what do you think of it?",4
Skills assessments,4
Pre-grad research,4
Working in Compensation as an I/O?,3
Interview Prep,3
"Bi-Weekly /r/IOpsychology Discussion - What have you been reading, and what do you think of it?",4
Job Description,5
"Bi-Weekly /r/IOpsychology Discussion - What have you been reading, and what do you think of it?",3
Does IO seem like a good fit?,4
IO Psych question,4
Business vs IO electives,4
Where can I sign up to do volunteer research/data analysis?,4
Exit interview resources,5
Measuring Regrettable Loss,4
Masters in I/O in Canada - Job Prospects?,5
"Bi-Weekly /r/IOpsychology Discussion - What have you been reading, and what do you think of it?",4
Repository of assessments?,4
Malpractice insurance for independent consultants?,4
Best books for someone learning SPSS for the first time?,5
What does research look like in IO Psych?,3
ONA for performance reviews,5
Would I be able to,3
Career advice,5
Question on Hertzberg's Two Factor Theory,3
OD workshop options help! ,6
got an admit from unh,4
"Looking for reading suggestions to learn more about ""climbing the ladder"" in an organization",3
Is there any way to detect cheating during or after the test in psychometrics?,3
Transition from Clinical to I/O; is a PhD worth it?,5
Role and pay transparency ,3
Connect the Dots: Knowledge Networks &amp; Social Organizations,4
Minor in business?,4
Meaningful Internship Recs?,4
Why does online ranking site US News say that University of Minnesota TC offers a masters in IO Psych when it is the Duluth campus that offers it only?,3
Leadership Skills Assessment Tools ,3
"Bi-Weekly /r/IOpsychology Discussion - What have you been reading, and what do you think of it?",4
Deciding between social or cognitive psych supervisor for undergrad thesis,3
LinkedIn as a new selection method,3
SHRM C Student Fee,3
"If I wanted to pursue psychometrics, would a masters in stats be better or should i still pursue I/o psych",3
You think a software can combat employee survey fatigue?,3
Ambient Data Analytics,3
MBA and Master of I/O? Worth it?,5
graduate programs/ best career path ?,4
"Bi-Weekly /r/IOpsychology Discussion - What have you been reading, and what do you think of it?",3
Resume Review Help for Grad School,3
How many of you work in consulting and how applied do you get in that realm?,4
I heard about this conference open to any I/O's interested in diversifying the field.,3
paths to IO Psych?,3
I/O psych bachelors + different behavioral/psych masters concentration.,3
Intro to Human Resources non Transferable (I/O - Applied Psych Major - HR Minor),3
Selection Assessment suggestions,3
Conference decisions,3
"Bi-Weekly /r/IOpsychology Discussion - What have you been reading, and what do you think of it?",3
Consulting,3
Course Syllabus on Mixed Methods Research?,3
"Bi-Weekly /r/IOpsychology Discussion - What have you been reading, and what do you think of it?",3
"Bi-Weekly /r/IOpsychology Discussion - What have you been reading, and what do you think of it?",3
Scholarships for MS in IO Psych.,3
IO Psychology and PR,3
What is usually the longest section of a research article?,3
"Bi-Weekly /r/IOpsychology Discussion - What have you been reading, and what do you think of it?",3
Teams Needs Assessment,3
Looking for a job after my degree,3
GRE Scores,3
Research on one-year timeline for employee onboarding?,3
I/O Adjacent Work?,6
Transitioning Careers,6
"Practitioners with PhDs, how much research do you do?",6
What statistical analyses should I do if I have multiple post-tests?,5
I-O Psychology in the Age of AI,7
Is GPA a flawed academic performance metric?,6
Pivoting into People Analytics from Social/Clinical Research,6
How Will AI Revolutionize Talent Assessments In 2024?,6
Can someone recommend any reference books for various assessments?,6
Erasmus Mundus Wop,6
How involved were your committee members in helping you develop your dissertation?,6
Grad students: How much drama is in your department?,6
"Bi-Weekly /r/IOpsychology Discussion - What have you been reading, and what do you think of it?",7
Where to get research experience while not in school?,7
Talent Acquisition Interview Workforce Capacity Analysis,7
Is another masters in quantitative methods or data analytics worth it?,6
Any Organisation Change Management Consultants in this sub?,7
Certs / Courses under $500,6
Opinions on eNPS?,7
First Career Step I/O (I hope) - Nonprofit HR Generalist,6
Advice needed for STEM IO psych colleges,7
Collaboration VS Performance Management,5
PhD vs. Work after Master?,6
Average GRE scores?,6
time well spent in lab meetings,7
Seeking Advice for conducting Future-Oriented Work Analysis with a Small Sample,5
Websites or platforms with stock of questions,7
HARKing,6
Journals for Current Work Motivation Research?,6
Should I keep studying this?,6
Board Review Help!,6
Alternative Method to Standardizing Test Scores,5
Where can I learn to do surveys,5
CV,6
Finding Research Lab?,7
"Bi-Weekly /r/IOpsychology Discussion - What have you been reading, and what do you think of it?",6
Undergraduate jobs,6
Why not select on intelligence?,5
Transitioning from clinical psychology to I/O,7
Recruiter a good first job?,7
How competitive is getting into a masters programs for I/O psych?,6
Seeking open source syllabus for intro IO psych class,6
Should I go to Academy of Management Conference?,6
General I/OP career advice,6
Brining Resume to SIOP,6
"Bi-Weekly /r/IOpsychology Discussion - What have you been reading, and what do you think of it?",5
Faculty with consulting business,7
Need an IO Psychologist Interviewee!,5
at what level does an msc org psych graduate applies for?,5
Job prospects after completing my masters degree in business psychology in Uk,7
Good YouTube videos for job analysis activities?,6
Survey Researcher,6
Certificate programs for I/O psych,5
I/O psychology in esports?,5
How to talk about validity and reliability in laymans terms,5
"Bi-Weekly /r/IOpsychology Discussion - What have you been reading, and what do you think of it?",5
Organizational psychology - need guidance on Canadian certifications,5
Internship opportunities for IOP PhD students?,5
Deploying selection assessments,5
Do I/O Psychs need a background in developmental psychology?,4
Best certificate program for I/O psych,4
Are internships in HR recommended if I eventually want to do a Ph.D. in OB?,6
"Bi-Weekly /r/IOpsychology Discussion - What have you been reading, and what do you think of it?",5
"""Head of Organizational Behavior Services"" as my title and experience. Where to build on a bachelors? Looking for input.",6
What is your 2-Minute Elevator Speech?,5
Masters vs Bachelors,6
Career Transition to IOP,5
Stats course,6
Choices,4
I'm taking a class called advanced personnel psychology. What can I do to to prepare myself?,6
Studies on how excessive meetings benefit slackers?,6
Curious Counseling Master Student,5
Dual bachelor's degrees - a good idea or unnecessary?,4
STEM I/O,5
Professional inquiry,5
Action planning sensitive surveys,5
ADHD at Work - Research,5
Im really confused about my pathway to becoming a organisational psychology (need assistance),4
"Bi-Weekly /r/IOpsychology Discussion - What have you been reading, and what do you think of it?",5
IO in MA or Applied&which to choose?,5
Industrial and Organizational Psychology Generalist Certificate,5
Landing a Job After Getting Masters,5
Organisational psychology in Australia,5
how easy would it be to get into I/O psychology with a master's in mental health counseling,5
"Non-EU, Non-Dutch speaker, Social, Health and Organizational Psychologist graduated from Dutch university trying to find a job",6
AI and I-O Psychology,6
how much research/data knowledge do you need before doing an IO Mc?,5
"Bi-Weekly /r/IOpsychology Discussion - What have you been reading, and what do you think of it?",5
Obtaining Item Desirability Ratings automatically using NLP: Paper and Web Application,5
Team interventions,5
New graduate looking jobs in Netherlands,4
"Bi-Weekly /r/IOpsychology Discussion - What have you been reading, and what do you think of it?",6
Proposing to Volunteer to do HR Analytical Work in Current Role (HRC),5
Organisational Health Index (OHI),5
Idea for an intervention on student organization member retention,6
I met some practitioners at the conference and they had an assessment tool for practice that measured something specific that interested me. Would it be rude to ask about taking the assessment at a discount or even for free just to see how it works?,5
SEM Help,5
Advice,5
Some questions from an undergraduate,7
Do you send thank you note email after each job interview?,5
How has survey fatigue affected your organization? How do you proactively manage survey fatigue?,7
Literature/white papers about hiring assessments?,8
Conducting Independent Research?,8
Soon to be MSc Business Psychology Graduate,10
Korn Ferry 360 Certification,9
Free time among academics vs practitioners?,10
Career advice,8
Licensure for consulting/networking,10
Is the GRE Worth It?,9
Good jobs for IO graduate students?,9
Defining I/O psychology to the general public,10
Question about calling yourself a psychologist ,9
"Bi-Weekly /r/IOpsychology Discussion - What have you been reading, and what do you think of it?",9
How to explain the purpose of an IQ test without calling it an IQ test?,8
Uncertain about the scope of I/O in India,11
Best School for Online Organizational Psychology Masters Degree?,11
Looking for advice in getting into consulting ,8
Searching for Literature,8
How to proactively measure strain/burnout/employee well-being?,9
Any advice for some grad students starting a pro bono consulting group?,8
Chances of finding jobs during SIOP?,8
"People who have had an interview for the masters, what is your biggest piece of advice?",8
Interesting traitify discussion,9
Should I get a data r programming certificate that my college offers as well as my bachelors in psych?,7
Resume/CV advice,8
Do you have any must read articles or any other literature?,9
FYI: Virtual event Jan 16 from MMPAW if you're looking to build your IO consultancy,8
Side hustles,8
data science,8
alone time?,8
Advice on entering this field!,8
"Bi-Weekly /r/IOpsychology Discussion - What have you been reading, and what do you think of it?",8
Best european city to work in i/o psychology?,7
Is it okay to submit a CV with internship applications?,7
is what i'm interested in a subtopic of IO Psych or is it more closely related to something else?,8
Statistics for feds in I/O,7
career change,7
Confused About My Path (Undergraduate),9
"Advice: People analytics, HCM, or HR technology enablement",8
ChatGPT saturday fun - prompts I used,8
Grad Student Informational Interview,8
"Employees are often frustrated by their organisation. A simple notion, the principal-agent problem, provides many insights into why it is the case.",8
Clarification on what counts as a criterion validation study (uniform guidelines Q),8
"Can creativity/innovation be ""managed""?",9
Looking for advice on analyzing survey data and best practices,8
"Bi-Weekly /r/IOpsychology Discussion - What have you been reading, and what do you think of it?",8
I/O jobs in New England?,9
Easy-to-read introductory texts on structured interviews?,8
Literature recommendations on employees refusing promotion,9
Are there undergraduate IO programs?,7
Double Major + Minor for I-O Career?,8
Resources on Critical Roles,9
Possible Internship Advice,8
Im looking into applying for the masters program near me. One of the requirements is a LOR from a psychology professor. Ive been out of school since 2017 therefore dont have any relationship with previous professors. Does anyone have any advice? Feeling kind of stuck with that.,8
Best route to get into consulting or to work for a consulting firm?,7
I/O Related job?,7
HR undergrad - can I still get into a Masters in I/O?,8
Getting into IO Psychology in college?,8
Help! I suck at Facilitations/Workshops!,7
I got passed over for a job because I stated in the future I would like to have a different job at the same place,9
Entry Level/Gain Experience,16
Anyone in consulting?,8
Is it necessary to have work experience before applying to grad school?,8
Leadership Development,7
Is anyone familiar with both SIOP and SOHP?,8
4+1 IO Masters Program  thoughts?,6
Struggling with job search any recommendations?,8
Suggestions for IO research topics related to game industry,7
"Canadian IOs, how are we doing in this job desert",7
Resume for Grad School Application,8
A Lurker Posts,7
How to deal with the 100+ facets of the Wave questionnaire...,6
IO Psych in the UK,7
Career Advice for a PhD Student in Organizational Behavior,7
Career paths,8
Job Help,7
Does anyone know whats the average pay for occupational psychs with 5-10 exp in the UK?,6
Looking for some research-backed change resistance models,7
"Why do 'wellbeing agencies' rarely show ROI on their interventions, or any monetary results?",6
[Discussion] Where are the posts about the NYC teachers exam payouts? This is huge I/O News.,7
Transitioning to IO Degree with a Varied HR Background and a 2.7 GPA,6
Time from ad to hiring,8
Just curious on some career choices within this field? I went to college w the intention of following w my masters in IO psych..,7
Non-academic research jobs,7
"Bi-Weekly /r/IOpsychology Discussion - What have you been reading, and what do you think of it?",7
"Studying Abroad, and Working at Home",7
Performance Review Software?,7
Informational book recommendations,8
Factor analysis vs. network analysis,7
What do applicants dislike about selection procedures?,6
"Bi-Weekly /r/IOpsychology Discussion - What have you been reading, and what do you think of it?",10
Just got accepted to UHCLs IO MA Program,8
Career advancement ,6
Job Recommendations for recent undergraduate looking to get PhD in IO Psych,7
Types of IO jobs? ,7
People Analytics Technical Interview,6
"Work, Sleep and Stress | How Job Passions Influence Well-being",6
Thoughts on 'Insights'?,7
How do you assess quality of primary research,6
Who here has left I/O and then successfully returned to I/O?,6
Social psychology PhD,13
Wanting to Move Away from HR and utilize my M.A. IO degree [California],15
Are you a consultant?,12
"Python! How to learn it? There is plenty of information online, so its hard to find the right path for IO psych. I remember I did an R course in Coursera that wasnt useful but a uni paper in a stats made all the difference. Any tips on how to start right on python?",13
"Personnel/Work Assessment: should a ""perfect"" score be attainable?",13
Employee Engagement in Large Company,12
Self-Taught Stats,13
Getting an entry level job,12
Summer Internships,13
Research regarding job applicants being too experienced?,12
Jobs outside of corporate or general career advice?,13
How serious is the researcher and practitioners gap is?,13
Does It Matter If It's An Online Degree or Not?,13
IO or HRM masters?,13
"ATTN: SIOP members, your input needed!!",13
Any PhD students decide to master out instead? How did it work out for you?,12
Why is MTSU IO Psychology program so acclaimed?,11
What would be included in the I/O Psych Iceberg? [Discussion],11
The Chicago White Sox: Narcissistic Leadership Tendencies at the Top,12
Is ETS a good company to join as a psychometrician?,12
Graduate Level Internship Searching,14
Best Stats Courses to Prepare for Masters Program?,12
"Having a hard time understanding the career path of a IO major. I have a psych degree and work in logistics transportation. Looking to move into something else and get a master in either HRM or IO. I get where youd go with HRM, but what are the actual jobs youd land with a masters in IO?",13
How much psychology do you use in your job?,11
Jobs for new IOP grad students,11
Book recommendations,11
Looking for career in Survey Analysis/Design,10
Job scene in USA,11
Organizational Behaviour vs I/O psychology vs Psychology?,11
2023 SIOP salary report,11
Summer remote internships? Gaining experience in I-O,11
best way to break into this field?,10
IO Psychology or Data Science? Question?,12
Had someone ask me today about the CliftonStrengths personality assessment. Is anyone familiar with it?,11
SIOP Jobnet Website,10
Breaking into Consulting with an I/O Degree: Seeking Insights &amp; Guidance,11
Anyone using Generative AI effectively in industry yet?,10
Internship Opportunities,11
Best validated and reliable psychometric tools?,11
SHRM Certification?,11
What upskilling and further development should I undertake as an IO psych grad?,12
Undergrad seeking field related jobs,10
Questions on determining the sample sizes for pulse surveys,12
A fork in my career path.,10
Is majoring in business a good idea?,10
Compensation Research in IO Psychology,9
"Those working in the netherlands, how much do you make with a masters degree from a dutch university ?",10
Career change,9
The SIOP 2024 Machine Learning Competition is Now Live,10
[X-post] useless interview questions,10
Math/Stats Knowledge Required to be an I/O Psychologist?,11
Reputable IO Training/Certs,11
Best Resoures for Learning IRT in R?,11
Has anyone decided to start their own consulting business? What are some tips for running your own firm ? How did you start and where how do you attain leads?,11
GPT use cases,10
Happening TODAY (Nov 6) and Nov 7: SIOP hosting a conference for undergraduate students interested in pursuing a PhD in I/O.,11
Talk me in/out of reaching out to a company about my dream job posting,10
Applicant reactions to selection tools,9
Human Resources Career vs. Consulting,10
Graduating IO Psych student,10
IO psychology to Clinical Psychology. How difficult?,12
Im currently an instructional designer. Going to the consultancy route. Helping companies develop elearning programs and departments. Would pursuing I/O psychology help my career?,11
How to transition Clin Psych to IO Psych,10
training and development articles recs?,11
Advice for an undergrad,12
Any recommendations for internships to look for?,11
What can I do to get more money?,9
MBTI &amp; Big five,10
How to Break Into I/O Jobs?,10
"Pyschometric experts / IO Pyschologist, how did you switch jobs?",10
