title,upvotes
Advice for current undergrad?,9
Looking for recommendations on books on structured interviews,11
Does the B.A. / B.S. distinction really matter for grad school/job apps?,9
Concern over not committing to an original thesis idea,9
Job analysis question for practitioners,10
Career with chronic illness?,10
IO folks working in the field - would you say that your work is interesting/meaningful/allows you to have work-life balance?,10
IO-related certificate programs or short courses?,9
Job hunting ,10
Hello fellow IO Psychologists! Do you think its ethical to use AI to generate psychometric assessments? ,9
Developer Experience vs IO Psychology,9
Why I/O?,9
Connections to health and positive psychology,10
How to become an IO Psychologist,9
Planning to get a I/O psychology M.A,9
Looking to study IO Psychology Abroad,10
scope of io in uk,9
Keywords for job searching?,10
Conference decisions,10
Is this the right subreddit to talk about job crafting and work design?,11
Current scenario of I/O or WAOP in UK and Australia?,9
"I desparately want an accademic research career, but I don't feel set up for success due to a lack of social support.",8
Changing career from teaching to consulting/IO related jobs,8
SIOP Guidelines for Education and Training,10
Choosing a Degree/Direction,7
How important is enjoying generalist HR work when determining if IO is right for me?,10
Career kickstart,9
Deprogramming the Cult of the Workplace Personality Test,9
Connecting / Networking in the Bay Area?,8
wasn't planning on going into HR but it seems like the easiest option,10
Angry reactions to a post about an intelligence test used in a hiring process. It's worth reading the comments for a clear take on why face validity and fairness perceptions matter to your selection system.,95
Not sure who else has put more energy into helping people get into IO,79
I/O Psychologists what is your job title,74
We are in the top 50 of psychology subreddits!,63
Predatory Graduate Programs in I-O Psychology,59
"Recent IO psych masters graduate hit a wall on long job search, any advice?",53
I/O Hot Takes,51
"Flaired ""data"" because it is facts",58
New allegations of research misconduct centered on Francesca Gino,48
Just got rejected for a Talent Development role for my personality,45
How to learn R for free?,43
Gordon Ramsey inspired me to go into IO Psychology,42
Interesting gamification personality test,41
How to learn R programming if you have no coding background?,39
Struggling to find job in IO after graduating,39
Unfulfilling Job,38
im a clueless college student but IO Psych is the first time ive felt like damn.. this is something i really want to pursue,37
Regretting M.S. I/O,37
Need Some Hope,38
Internships are Tough: An Overview of One Grad Student's Experience,35
"Haven't heard back from over 70+ I/O psychology-related internships (HR, recruitment, Marketing, etc.) and summer is almost here. What am I doing wrong?",38
Academia is broken ....,31
 I havent read one single book or article after I graduated,29
EA has interesting selection criteria.,31
Anyone applying for a Master's in I/O Psychology course for 2024? Is I/O worth it?,30
"Thoughts on the recent HR tech consolidation? (Perceptyx acquires Humu, HireVue acquires Modern Hire, Harver acquires Pymetrics)",30
Am I paranoid or the job market is actually bad?,31
What is your Job Title?,29
"Job Search, M.A in IO",28
salary?,28
So like&what do you guys do as industrial organizational psychologists on a daily basis?,27
Why do so many I/O folks become self-employed consultants and how viable is that really?,27
"This Thursday: a panel on life after grad school, focusing on the job search and career paths. Register using the link: http://bit.ly/LifeAfterGradSchool",27
Is a phd worth it if I dont want to go into academia?,28
2023 Grad School Q&amp;A Mega-Thread,26
What do you work as a IO Psychologist? ,25
The DSM of I-O Psychology,24
"IO Psychologists working in industry, how do you access research and keep up with it?",27
We still have a little time left before AI takes our jobs.,24
Conclusions from Landers et al. 2023,23
How difficult was it for you to find a well paying career after you graduated? And more questions.,22
Job search is bleak,21
"What's a statistical / research methodology, that's not usually taught in grad programs, that you think more IO's should be aware about?",23
How did you obtain clients as an I/O consultant?,20
Additional Income?,21
"ChatGPT/DALLE rendering of a ""stereotypical IO psychologist actively working""",21
Im considering a Masters in Industrial and Organizational Psychology. What jobs would be available to me post-graduation? HR jobs are recommended. Anything else? Please share your own experiences.,21
Looking for jobs after graduating from a Masters Program,21
Can anyone who landed a job in the past few years please share an anonymized version of their resume?,20
Writing A Job Analysis,20
Rejecting a job offer that I really wanted&,20
2023 Graduate Program start,20
Can you make $100k without a master's? Can you become a consultant without a master's?,20
Harvard Business Review,19
Feeling Stuck,19
SIOP 2023,20
Well-being at Work,18
I/O Psych job outlook and security within the next 10 years,18
Most popular meta-analyses,18
Salary Outlook For Master's-Level I/O Psychologists,19
What made you choose IO over other areas of psychology?,17
what are some good book to read on IO psychology for a beginner?,17
Could Waffle House claim fighting is a BFOQ?,18
Master's in IO Psyc ( ~1.5 yrs post-grad) Looking for Job Search Advice!,19
"BusinessInsider: Francesca Gino's $25 million lawsuit will scare researchers away from calling out suspected fraud, scholars fear",16
I want to switch away from our field. What careers would be easy to transition to?,17
A few questions about careers in IO Psych,18
AI Affecting I/O?,16
Any Good I/O Related Jobs Before Getting Masters?,18
IO Job Posting,16
Join the 2024 SIOP Machine Learning Competition,16
Positive/ Inspiring I/O Stories,17
what do you learn from a research paper?,17
What are the books/journal articles/literature that you live by as a researcher/practitioner in I/O Psychology?,17
"Those of you in applied work, what are your experiences with R Studio?",15
What are the most essential parts of stats to know for going into industry?,16
"Found this sub and am now panicking, looking for advice",15
"Applied Researchers: if you could do your PhD over again, how would you do it?",15
"As current IO practitioners and lifelong IO ""students""",15
Academics: think about the best grad-student youve ever had or worked with. What made them so great?,14
Work-Life Balance &amp; Business Consulting ,16
Serious question ,15
Jobs Titles for Selection and Assessment,14
IO psych or not,13
Passive Income,14
Hows the job market within IO or Hr right now?,15
Entry-Level Psychometrics,16
Can you recomend interesting Industrial/organizational Psycology literature to help me prepare for my gradschool interview?,14
Internship Questions,14
Good introductory I/O textbooks?,14
AI seems poised to take over many jobs how will this affect I/O as a field,14
Thinking of pursuing my MS in I/O- advice?,14
SIOP Conference - should I attend?,12
Seeking your positive work life stories,14
Can a Masters in I/O Psych allow me to teach undergraduate psychology?,13
Best and Worse Part of Your Job,13
"Free virtual conference for undergraduate students interested in obtaining a PhD in I/O, hosted by SIOP on Nov. 6th and 7th. Save the date!",13
Behavioural Interview,13
"For those of you that went applied, how did you handle theory-heavy readings in grad school?",14
How can IO Psychology be leveraged to fight the War on Climate Change?,14
